{
  "schema_version": "1.0",
  "status": "PROVISIONAL_RESEARCH",
  "source_document": "docs/dependency-map/001-conventional-calculus-prerequisite-graph.md",
  "scope": "Concept-level material dependencies used to derive the Core 0.1 candidate teaching layers from the current dependency research. This companion does not establish E1, E2, or E3 PASS and does not classify every possible calculus dependency.",
  "authority_note": "CORE_0.1_COMPLETENESS_CHECKLIST.md names Chad Coulter as owner of E1-E3. This inventory is contributor evidence for review, not a release-gate decision.",
  "allowed_classes": [
    "HARD",
    "STRONG",
    "SUPPORTING",
    "HISTORICAL/CURRICULAR"
  ],
  "topology_policy": {
    "constraint_classes": [
      "HARD",
      "STRONG"
    ],
    "non_constraint_classes": [
      "SUPPORTING",
      "HISTORICAL/CURRICULAR"
    ],
    "description": "Only HARD and STRONG edges constrain the generated candidate topological layers. SUPPORTING and HISTORICAL/CURRICULAR edges remain visible but do not force layer order."
  },
  "declared_roots": [
    {
      "node": "functions_algebra_trigonometry",
      "kind": "FOUNDATIONAL_ROOT",
      "rationale": "The current graph begins the main single-variable trunk at Functions / algebra / trigonometry."
    },
    {
      "node": "linear_algebra",
      "kind": "PARALLEL_DOMAIN_ROOT",
      "rationale": "The current graph introduces Linear algebra as an independent join into the systems branch."
    },
    {
      "node": "vectors_coordinates",
      "kind": "PARALLEL_DOMAIN_ROOT",
      "rationale": "The current graph introduces vectors / coordinates as an independent entry to the multivariable and vector-calculus branches."
    },
    {
      "node": "trigonometric_series",
      "kind": "UNRESOLVED_SOURCE_GAP",
      "rationale": "The current source gives Trigonometric series an outgoing dependency to Fourier methods but does not classify an incoming prerequisite. No missing prerequisite is inferred here."
    }
  ],
  "open_questions": [
    {
      "id": "q001",
      "related_nodes": [
        "trigonometric_series"
      ],
      "question": "What classified prerequisite, if any, should feed Trigonometric series?",
      "reason": "The source graph supplies an outgoing edge to Fourier methods but no incoming material dependency."
    },
    {
      "id": "q002",
      "related_nodes": [
        "line_integrals",
        "surface_integrals",
        "integration_techniques"
      ],
      "question": "Should line and surface integrals carry an explicit cross-branch dependency from integration machinery?",
      "reason": "The current graph routes Vector fields directly to Line integrals and Surface integrals without classifying a cross-branch integration prerequisite."
    },
    {
      "id": "q003",
      "related_nodes": [
        "green_stokes_divergence",
        "line_integrals",
        "surface_integrals"
      ],
      "question": "How should the integral-theorem layer move if the missing cross-branch integration dependency is later established?",
      "reason": "The generated layer for Green / Stokes / Divergence is sensitive to the unresolved cross-branch dependency in q002."
    }
  ],
  "nodes": [
    {
      "id": "functions_algebra_trigonometry",
      "label": "Functions / algebra / trigonometry",
      "family": "FOUNDATION",
      "include_in_teaching_layers": true
    },
    {
      "id": "limits",
      "label": "Limits",
      "family": "FOUNDATION",
      "include_in_teaching_layers": true
    },
    {
      "id": "continuity",
      "label": "Continuity",
      "family": "FOUNDATION",
      "include_in_teaching_layers": true
    },
    {
      "id": "sequences_convergence",
      "label": "Sequences / convergence",
      "family": "SERIES",
      "include_in_teaching_layers": true
    },
    {
      "id": "derivative_definition",
      "label": "Derivative definition",
      "family": "DIFFERENTIATION",
      "include_in_teaching_layers": true
    },
    {
      "id": "infinite_series",
      "label": "Infinite series",
      "family": "SERIES",
      "include_in_teaching_layers": true
    },
    {
      "id": "differentiation_rules",
      "label": "Differentiation rules",
      "family": "DIFFERENTIATION",
      "include_in_teaching_layers": true
    },
    {
      "id": "power_series",
      "label": "Power series",
      "family": "SERIES",
      "include_in_teaching_layers": true
    },
    {
      "id": "derivative_applications_rates_extrema",
      "label": "Derivative applications: rates / extrema",
      "family": "DIFFERENTIATION",
      "include_in_teaching_layers": true
    },
    {
      "id": "local_linearity",
      "label": "Local linearity",
      "family": "DIFFERENTIATION",
      "include_in_teaching_layers": true
    },
    {
      "id": "taylor_series",
      "label": "Taylor series",
      "family": "SERIES",
      "include_in_teaching_layers": true
    },
    {
      "id": "antiderivatives",
      "label": "Antiderivatives",
      "family": "INTEGRATION",
      "include_in_teaching_layers": true
    },
    {
      "id": "definite_integral",
      "label": "Definite integral",
      "family": "INTEGRATION",
      "include_in_teaching_layers": true
    },
    {
      "id": "fundamental_theorem_calculus",
      "label": "Fundamental Theorem of Calculus",
      "family": "INTEGRATION",
      "include_in_teaching_layers": true
    },
    {
      "id": "integration_techniques",
      "label": "Integration techniques",
      "family": "INTEGRATION",
      "include_in_teaching_layers": true
    },
    {
      "id": "integral_applications",
      "label": "Integral applications",
      "family": "INTEGRATION",
      "include_in_teaching_layers": true
    },
    {
      "id": "first_order_odes",
      "label": "First-order differential equations",
      "family": "ODE_DYNAMICS",
      "include_in_teaching_layers": true
    },
    {
      "id": "second_order_odes",
      "label": "Second-order ODEs",
      "family": "ODE_DYNAMICS",
      "include_in_teaching_layers": true
    },
    {
      "id": "numerical_slope_field_methods",
      "label": "Numerical / slope-field methods",
      "family": "ODE_DYNAMICS",
      "include_in_teaching_layers": true
    },
    {
      "id": "linear_algebra",
      "label": "Linear algebra",
      "family": "LINEAR_SYSTEMS",
      "include_in_teaching_layers": true
    },
    {
      "id": "linear_systems",
      "label": "Linear systems",
      "family": "LINEAR_SYSTEMS",
      "include_in_teaching_layers": true
    },
    {
      "id": "eigen_methods",
      "label": "Eigen methods",
      "family": "LINEAR_SYSTEMS",
      "include_in_teaching_layers": true
    },
    {
      "id": "phase_portraits",
      "label": "Phase portraits",
      "family": "LINEAR_SYSTEMS",
      "include_in_teaching_layers": true
    },
    {
      "id": "systems_of_odes",
      "label": "Systems of ODEs",
      "family": "ODE_DYNAMICS",
      "include_in_teaching_layers": true
    },
    {
      "id": "series_solutions_odes",
      "label": "Series solutions of ODEs",
      "family": "ODE_DYNAMICS",
      "include_in_teaching_layers": true
    },
    {
      "id": "laplace_transforms_convolution",
      "label": "Laplace transforms / convolution",
      "family": "ODE_DYNAMICS",
      "include_in_teaching_layers": true
    },
    {
      "id": "trigonometric_series",
      "label": "Trigonometric series",
      "family": "SERIES",
      "include_in_teaching_layers": true
    },
    {
      "id": "fourier_methods",
      "label": "Fourier methods",
      "family": "ODE_DYNAMICS",
      "include_in_teaching_layers": true
    },
    {
      "id": "vectors_coordinates",
      "label": "Vectors / coordinates",
      "family": "MULTIVARIABLE",
      "include_in_teaching_layers": true
    },
    {
      "id": "multivariable_functions",
      "label": "Functions of several variables",
      "family": "MULTIVARIABLE",
      "include_in_teaching_layers": true
    },
    {
      "id": "partial_derivatives",
      "label": "Partial derivatives",
      "family": "MULTIVARIABLE",
      "include_in_teaching_layers": true
    },
    {
      "id": "gradient",
      "label": "Gradient",
      "family": "MULTIVARIABLE",
      "include_in_teaching_layers": true
    },
    {
      "id": "multivariable_chain_rule",
      "label": "Multivariable chain rule",
      "family": "MULTIVARIABLE",
      "include_in_teaching_layers": true
    },
    {
      "id": "optimization_lagrange",
      "label": "Optimization / Lagrange multipliers",
      "family": "MULTIVARIABLE",
      "include_in_teaching_layers": true
    },
    {
      "id": "multiple_integrals",
      "label": "Multiple integrals",
      "family": "MULTIVARIABLE",
      "include_in_teaching_layers": true
    },
    {
      "id": "change_variables_jacobians",
      "label": "Change of variables / Jacobians",
      "family": "MULTIVARIABLE",
      "include_in_teaching_layers": true
    },
    {
      "id": "vector_fields",
      "label": "Vector fields",
      "family": "VECTOR_CALCULUS",
      "include_in_teaching_layers": true
    },
    {
      "id": "line_integrals",
      "label": "Line integrals",
      "family": "VECTOR_CALCULUS",
      "include_in_teaching_layers": true
    },
    {
      "id": "surface_integrals",
      "label": "Surface integrals",
      "family": "VECTOR_CALCULUS",
      "include_in_teaching_layers": true
    },
    {
      "id": "green_stokes_divergence",
      "label": "Green / Stokes / Divergence theorems",
      "family": "VECTOR_CALCULUS",
      "include_in_teaching_layers": true
    },
    {
      "id": "calc_iii_course_bundle",
      "label": "Calc III as a course bundle",
      "family": "CURRICULAR_CONTAINER",
      "include_in_teaching_layers": false
    },
    {
      "id": "vector_calculus_bundle",
      "label": "Vector calculus as a course/topic bundle",
      "family": "CURRICULAR_CONTAINER",